{
  "$schema": "https://json-schema.org/draft/2020-12/schema",
  "$id": "https://marinjursic.github.io/production-readiness-checklist/schemas/control-classification-final.schema.json",
  "title": "Production Readiness Final Control Classifications v0.1",
  "type": "object",
  "additionalProperties": false,
  "required": ["schema_version", "packet_id", "methodology_sha256", "registry_version", "registry_sha256", "source_path", "control_count", "controls"],
  "properties": {
    "schema_version": {"const": "prc.control-classification-final/v0.1"},
    "packet_id": {"type": "string", "pattern": "^[a-z0-9]+(?:-[a-z0-9]+)*-part-[0-9]{3}$"},
    "methodology_sha256": {"type": "string", "pattern": "^[0-9a-f]{64}$"},
    "registry_version": {"type": "string", "pattern": "^[0-9]+\\.[0-9]+\\.[0-9]+$"},
    "registry_sha256": {"type": "string", "pattern": "^[0-9a-f]{64}$"},
    "source_path": {"type": "string", "minLength": 1, "maxLength": 1000},
    "control_count": {"type": "integer", "minimum": 1, "maximum": 250},
    "controls": {
      "type": "array",
      "minItems": 1,
      "maxItems": 250,
      "items": {"$ref": "#/$defs/classification"}
    }
  },
  "$defs": {
    "clause": {
      "type": "object",
      "additionalProperties": false,
      "required": ["statement", "checker_family", "evidence_authority"],
      "properties": {
        "statement": {"type": "string", "minLength": 1, "maxLength": 2000},
        "checker_family": {
          "enum": ["inventory_fact", "structured_document", "package_metadata", "ci_policy", "container_iac", "source_ast", "artifact_integrity", "analysis_adapter", "execution_evidence", "environment_evidence", "structured_record"]
        },
        "evidence_authority": {
          "enum": ["repository", "artifact", "executed", "environment", "external_registry", "structured_record"]
        }
      }
    },
    "classification": {
      "type": "object",
      "additionalProperties": false,
      "required": ["control_id", "revision", "semantic_sha256", "classification", "route", "reason", "deterministic_clauses", "nondeterministic_reason_codes", "decision_basis", "skeptical_verdict", "counterexample_analysis"],
      "properties": {
        "control_id": {"type": "string", "pattern": "^(PRC-[0-9]{2}-[0-9]{3}|USEQ-[A-F0-9]{8})$"},
        "revision": {"type": "integer", "minimum": 1},
        "semantic_sha256": {"type": "string", "pattern": "^[0-9a-f]{64}$"},
        "classification": {"enum": ["deterministic", "nondeterministic"]},
        "route": {
          "enum": ["local_static", "artifact_verification", "bounded_execution", "external_readonly_query", "structured_record_validation", "deterministic_composite", "contextual_judgment", "accountable_human_decision", "specialist_or_legal_judgment", "empirical_protocol_undefined", "contract_incomplete", "mixed", "unbounded_claim"]
        },
        "reason": {"type": "string", "minLength": 20, "maxLength": 4000},
        "deterministic_clauses": {"type": "array", "maxItems": 50, "items": {"$ref": "#/$defs/clause"}},
        "nondeterministic_reason_codes": {
          "type": "array",
          "maxItems": 9,
          "uniqueItems": true,
          "items": {"enum": ["contextual_judgment", "human_accountability", "legal_or_specialist_authority", "undefined_protocol", "undefined_scope", "undefined_threshold", "mixed_with_nondeterministic_child", "unbounded_scope", "classification_not_approved"]}
        },
        "decision_basis": {"enum": ["primary_nondeterministic", "two_stage_confirmed", "skeptically_rejected", "strength_audit_confirmed", "strength_audit_reclassified"]},
        "skeptical_verdict": {"type": ["string", "null"], "enum": [null, "confirmed_deterministic", "rejected_nondeterministic"]},
        "counterexample_analysis": {"type": ["string", "null"], "minLength": 20, "maxLength": 4000}
      }
    }
  }
}
